{
    "$schema": "../../schemas/recipe.json",
    "title": "Mascarpone and lime torte",
    "ingredients": [
        { "name": "ginger snap biscuits", "quantity": 200, "unit": "g", "description": "Crushed" },
        { "name": "butter", "quantity": 50, "unit": "g", "description": "Melted" },
        { "name": "mascarpone cheese", "quantity": 500, "unit": "g" },
        { "name": "icing sugar", "quantity": 40, "unit": "g" },
        { "name": "limes", "quantity": 2, "description": "Zest and juice" },
        { "name": "dark chocolate", "quantity": 50, "unit": "g" },
        { "name": "caster sugar", "quantity": 50, "unit": "g" },
        { "name": "Strawberries", "description": "A handful for decoration" }
    ],
    "methods": [
        "Mix together the crushed biscuits and melted butter and press into the base of a 18cm (7 inch) spring sided, or loose bottomed cake tin.",
        "Place the mascarpone, icing sugar, lime zest and juice in a bowl and beat together. Spread over the biscuit base. Chill for 30 minutes.",
        "To decorate, melt the chocolate as per pack instructions. Wash and pat dry some fresh rose leaves. Pull the underside of the leaves along the melted chocolate until coated. Allow leaves to dry coated side up.",
        "Meanwhile to frost the grapes, dip in water, shake off excess and coat with caster sugar.",
        "Then carefully peel away each rose leaf starting at the stem and arrange with the grapes on top of the torte."
    ],
    "keywords": ["Dessert", "Vegetarian"],
    "image": "/recipeasy/mascarpone-and-lime-torte.jpg",
    "description": "Here's a wonderful summer cheesecake dessert that's not only incredibly easy and quick to make but looks and tastes fantastic too.",
    "serves": 1,
    "prepTime": 45,
    "cookTime": 0,
    "diet": ["vegetarian"]
}
