{
  "$schema": "../../schemas/recipe.json",
  "title": "Tarragon chicken",
  "ingredients": [
    { "name": "garlic butter", "quantity": 75, "unit": "g" },
    { "name": "olive oil", "quantity": 1, "unit": "tbsp" },
    { "name": "chicken breasts", "quantity": 4, "description": "Cut in half" },
    { "name": "white wine", "quantity": 150, "unit": "ml" },
    { "name": "tarragon", "quantity": 15, "unit": "g" },
    { "name": "green grapes", "quantity": 125, "unit": "g" },
    { "name": "double cream", "quantity": 150, "unit": "ml" },
    { "name": "parsley", "quantity": 10, "unit": "g", "description": "Chopped" }
  ],
  "methods": [
    "Melt the butter and the olive oil in a frying pan over a medium heat, then season the chicken with plenty of salt and freshly ground black pepper. Fry the chicken steaks for approximately 4 mins on each side until golden.",
    "Add white wine, tarragon and grapes to the pan, then bring mixture to the boil and lower the heat. Stir in the cream and parsley and serve immediately with a selection of steamed vegetables and boiled new potatoes."
  ],
  "keywords": ["Dinner", "Meat", "French"],
  "image": "tarragon-chicken.webp",
  "description": "The French love rich sauces made with a hint of wine and a handful of fresh herbs and this mouthwatering dish is based on one of their classic cordon bleu recipes. The combined flavours are so delicious, you won't believe how easy and quick it is to make this lovely dish.",
  "serves": 4,
  "prepTime": 5,
  "cookTime": 15
}
