{
  "$schema": "../../schemas/recipe.json",
  "title": "Healthy beef chow mein",
  "ingredients": [
    { "name": "egg noodle nests", "quantity": 2 },
    { "name": "sesame oil", "quantity": 2, "unit": "tsp" },
    {
      "name": "fillet steak",
      "quantity": 200,
      "unit": "g",
      "description": "Cut into strips"
    },
    { "name": "red onion", "quantity": 1, "description": "Finely chopped" },
    {
      "name": "ginger",
      "quantity": 15,
      "unit": "g",
      "description": "Peeled and finely chopped"
    },
    {
      "name": "chestnut mushrooms",
      "quantity": 160,
      "unit": "g",
      "description": "Thickly sliced"
    },
    { "name": "garlic cloves", "quantity": 2, "description": "Finely chopped" },
    { "name": "beansprouts", "quantity": 160, "unit": "g" },
    { "name": "tamari", "quantity": 1.5, "unit": "tsp" },
    { "name": "brown rice vinegar", "quantity": 1, "unit": "tbsp" },
    {
      "name": "spring onions",
      "quantity": 4,
      "description": "Cut into diagonal lengths"
    }
  ],
  "methods": [
    "Cook the noodles following pack instructions. Meanwhile, heat half the oil in a wok and stir-fry the beef over a high heat for 30 seconds until browned. Tip onto a plate, set aside, then add the remaining oil to the wok. Stir-fry the onion and ginger until softened. Add a drop of water to prevent burning, if needed and cook covered for 2-3 mins.",
    "Stir in the mushrooms and garlic, and fry until they start to soften (around 3 mins), then add the beansprouts and cook for a minute or two more until piping hot.",
    "Mix the tamari and vinegar together in a small bowl with 2 tbsp water. Add the drained noodles to the wok, toss well, then add the tamari mixture, spring onions and the beef. Stir-fry for a few minutes until heated through. Season with plenty of black pepper and serve."
  ],
  "keywords": ["Dinner", "Meat", "Chinese", "Asian"],
  "image": "/recipeasy/healthy-beef-chow-mein.webp",
  "description": "Swap your weekly takeaway for this healthy beef chow mein - it's quick to cook and low in fat and calories.",
  "serves": 2,
  "prepTime": 10,
  "cookTime": 10
}
